{
  "$schema": "https://json-schema.org/draft/2020-12/schema",
  "$id": "https://thirdi.net/schemas/portal/project.schema.json",
  "title": "Projects file (projects.json)",
  "description": "All client-visible projects with full detail hierarchy. Commercial scope displays only when approved for the client.",
  "type": "object",
  "additionalProperties": false,
  "required": ["schemaVersion", "tenant", "clientSafe", "asOf", "projects"],
  "properties": {
    "schemaVersion": { "type": "string", "const": "2.0.0" },
    "tenant": { "$ref": "common.schema.json#/$defs/tenant" },
    "clientSafe": { "type": "boolean", "const": true },
    "asOf": { "$ref": "common.schema.json#/$defs/isoDate" },
    "projects": { "type": "array", "items": { "$ref": "project.schema.json#/$defs/project" } }
  },
  "$defs": {
    "timelineItem": {
      "type": "object",
      "additionalProperties": false,
      "required": ["state", "title"],
      "properties": {
        "state": { "$ref": "common.schema.json#/$defs/timelineState" },
        "title": { "$ref": "common.schema.json#/$defs/nonEmptyText" },
        "detail": { "type": "string" }
      }
    },
    "deliverable": {
      "type": "object",
      "additionalProperties": false,
      "required": ["title", "state"],
      "properties": {
        "title": { "$ref": "common.schema.json#/$defs/nonEmptyText" },
        "state": { "type": "string" },
        "detail": { "type": "string" },
        "assetId": { "type": "string" }
      }
    },
    "blockerComment": {
      "type": "object",
      "description": "A curated blocker is represented as a comment in the client portal, with optional scene and date context.",
      "additionalProperties": false,
      "required": ["kind", "blocker", "title"],
      "properties": {
        "kind": { "type": "string", "const": "comment" },
        "blocker": { "type": "boolean", "const": true },
        "title": { "$ref": "common.schema.json#/$defs/nonEmptyText" },
        "description": { "type": "string" },
        "sceneId": { "type": "string" },
        "createdAt": { "type": "string", "format": "date-time" }
      }
    },
    "report": {
      "type": "object",
      "additionalProperties": false,
      "required": ["title", "body"],
      "properties": {
        "title": { "$ref": "common.schema.json#/$defs/nonEmptyText" },
        "body": { "$ref": "common.schema.json#/$defs/nonEmptyText" },
        "source": { "$ref": "common.schema.json#/$defs/source" }
      }
    },
    "scope": {
      "type": "object",
      "description": "Commercial scope/investment. Displayed only when ownerApproved is true; otherwise the UI shows 'Scope required'.",
      "additionalProperties": false,
      "required": ["ownerApproved", "model"],
      "properties": {
        "ownerApproved": { "type": "boolean" },
        "model": { "type": "string", "description": "Outcome/scope-led model, e.g. 'Fixed scope' or 'Effort range'." },
        "effortRange": { "type": "string" },
        "demoEffort": { "type": "string" },
        "priceStatement": { "type": "string" },
        "assumptions": { "type": "array", "items": { "type": "string" } },
        "note": { "type": "string" },
        "source": { "$ref": "common.schema.json#/$defs/source" }
      }
    },
    "thumbnail": {
      "type": "object",
      "additionalProperties": false,
      "required": ["mediaState"],
      "properties": {
        "mediaState": { "$ref": "common.schema.json#/$defs/mediaState" },
        "assetId": { "type": "string" },
        "label": { "type": "string" }
      }
    },
    "productionLifecycle": {
      "type": "object",
      "description": "Separates demo development from full-film production and records when a locked demo is embedded in the project workspace, then advanced in place after approval.",
      "additionalProperties": false,
      "required": ["projectPhase", "demoPhase", "fullFilmPhase", "selectedIdeaIds", "promotionState"],
      "properties": {
        "projectPhase": { "type": "string", "enum": ["brainstorming", "direction-selection", "demo-production", "demo-review", "demo-approved", "full-production", "final-review", "delivered", "paused", "archived"] },
        "demoPhase": { "type": "string", "enum": ["not-started", "brainstorming", "selecting", "building", "in-review", "approved"] },
        "fullFilmPhase": { "type": "string", "enum": ["not-started", "in-production", "in-review", "delivered"] },
        "selectedIdeaIds": { "type": "array", "uniqueItems": true, "items": { "$ref": "common.schema.json#/$defs/slug" } },
        "canonicalIdeaId": { "$ref": "common.schema.json#/$defs/slug" },
        "promotedIdeaId": { "$ref": "common.schema.json#/$defs/slug" },
        "promotionState": { "type": "string", "enum": ["not-selected", "embedded", "eligible", "promoted"] }
      }
    },
    "project": {
      "type": "object",
      "additionalProperties": false,
      "required": ["id", "slug", "type", "title", "status", "projectType", "valueStatement", "source"],
      "properties": {
        "id": { "$ref": "common.schema.json#/$defs/id" },
        "slug": { "$ref": "common.schema.json#/$defs/slug" },
        "type": { "type": "string", "enum": ["film", "standard"] },
        "title": { "$ref": "common.schema.json#/$defs/nonEmptyText" },
        "displayName": { "type": "string" },
        "status": { "type": "string", "enum": ["active", "completed", "paused", "archived", "proposed"] },
        "statusLabel": { "type": "string" },
        "startedAt": { "$ref": "common.schema.json#/$defs/isoDate" },
        "hoursInvested": { "type": "number", "minimum": 0 },
        "projectType": { "$ref": "common.schema.json#/$defs/nonEmptyText" },
        "valueStatement": { "$ref": "common.schema.json#/$defs/nonEmptyText" },
        "objective": { "type": "string" },
        "audience": { "type": "string" },
        "creativeVision": { "type": "string", "description": "The living creative idea for the entire project." },
        "keyMessaging": { "type": "array", "items": { "type": "object", "additionalProperties": false, "required": ["title", "detail"], "properties": { "title": { "$ref": "common.schema.json#/$defs/nonEmptyText" }, "detail": { "$ref": "common.schema.json#/$defs/nonEmptyText" } } } },
        "phase": { "type": "string" },
        "nextMilestone": { "type": "string" },
        "runtime": { "type": "string" },
        "thumbnail": { "$ref": "project.schema.json#/$defs/thumbnail" },
        "productionLifecycle": { "$ref": "project.schema.json#/$defs/productionLifecycle" },
        "draft": { "type": "boolean", "description": "True while media are AI-assisted drafts, triggering the draft notice." },
        "messaging": { "type": "array", "items": { "type": "string" } },
        "theme": { "type": "string" },
        "vision": { "type": "string" },
        "mainMediaAssetId": { "type": "string" },
        "script": { "type": "string" },
        "storyboardNote": { "type": "string" },
        "deliverables": { "type": "array", "items": { "$ref": "project.schema.json#/$defs/deliverable" } },
        "assets": { "type": "array", "items": { "$ref": "asset.schema.json#/$defs/asset" } },
        "timeline": { "type": "array", "items": { "$ref": "project.schema.json#/$defs/timelineItem" } },
        "blockers": { "type": "array", "items": { "$ref": "project.schema.json#/$defs/blockerComment" } },
        "reports": { "type": "array", "items": { "$ref": "project.schema.json#/$defs/report" } },
        "related": { "type": "array", "items": { "type": "string" } },
        "scope": { "$ref": "project.schema.json#/$defs/scope" },
        "film": { "$ref": "film.schema.json#/$defs/filmBlock" },
        "comment": { "$ref": "common.schema.json#/$defs/commentTarget" },
        "source": { "$ref": "common.schema.json#/$defs/source" }
      }
    }
  }
}
